{
  "format": "imani-bid-proof/1",
  "lot": {
    "lotId": "DRY-01",
    "network": "test",
    "lotAddress": "utest1weuh7jetfegkdjs8nnmgcrjprk0eeckgdhel38v3a7w7mju5hyzgfkxhdckzv4sc4ejduyfdreaurvnw2rgdq4enmssnka9way22fxwg",
    "openHeight": 4489077,
    "closeHeight": 4489085
  },
  "bid": {
    "txid": "b76cd31fa4584857b84e16357e2fd6e958a59a9e63661529b52a93867ad8ed7c",
    "height": 4489081,
    "pool": "ironwood",
    "index": 1,
    "amountZat": 3000000,
    "memo": "bid:DRY-01:q7k2:utest1sek2kvwu4ywmvyl44g8gdj8ggsmzexd0urxkefn745m27jje86hjdu8maazpn65le65cte7q00l64h8qsycaea5j5scx0am92ssdg9r0",
    "word": "q7k2"
  },
  "openingKey": "44eae83e606acdbd0d57f3acfdf0e3e8ca54081c11187f26705ea5c3b71a6427",
  "txHex": "0600008098b684d8d90a197700000000a07f440000000000000261cbecc0f17385dc25336bd5c6c44ea5918a05c5b35ec1ad1459ddb96dbc7c907a908efa67858f38d7a30b562b5fe8a36e7d2be90b5ca7107bf26a40dc176819f8f9f2b92b5ca93a8567f92077c2819f50b98457be925840ef229957802aafa698e11c55b35ac87186162ec607628ff3f5f8829dab1877e8eceb78bce2fdb002a2bfcbe78d8a4edc217abcada7cd2caf85b5e6f6da0aae39d2c6515b3eeb560468ff855c01dd39e173aa3afc6a34e2859099c287a7f8417792949bc442b9237e1c656a3c57b8f4efaa08bc382924283e13b16f924120add9701983a0ca6e689cd13b6172de825f8bcb7998b39e282a6cd0628a44f2fe541a931c043c23e5ad7d73e57c57b9ac50db95dba47ce5ed4349489c48c0dde73c6cfd6d4201b438e3e1f737dee70a859dd8c0d03ce26d79c671ec29da2572459406118e54f01e71756c1fb0e5132adfecff7edfaa8d60a31a749df6040dc2edc27e930e9ccbc9d0f65a06bde549b7ac9ff79bf096f663c5a6c8694e46301ed4c2e402d5b68f023e1bb2fcb1877090814645f4724a78833c936f815f27811622d111710aff3f5b204fd77bd449adb262d0e8d069bf88c67a2d516000c9985f22adc1566a28207dd9cd7470b266b07ab2ac82414f78e63cd541183b8249b7d970c68bac47d5c95214665b829870dd0fc0ea8785aeead09777f01ae8453b5961a65dd07bc98295a88510eb87b6ff4f3c5f68b2635225a0ca42e1c8b997000867d3f0139c832bd4dd707fd819eae9b7fa5bee918016bb8f06d8eee26a7cf94e869b71168c5d05a371dc059a165f62ccab7bd618f59cdacce390f84256ac9e623143bc678cb42313853d09eb34db747e0ba7fdf6008ddd96189bf7abb4066c92f9472722ee2e99eaf4e00aa6f9bd2f6c9ad78c8164b639d94f086e5de215e7b9e633eaa561f132ff2c7580f8f06bdbb455a27c8569ae31b7a9bfdbac676cd8387fac96055171e07775e7ee96e49b3395f09608e0eb5cf38fed91e3c5921515b238e67ea296d6f6d6962a7dd675ebbbc4029aa0c840440f15d09c85902505aaaaa4f1d013978ffbb940fa4c836b3338f1026236755a82d327d48b7494a254476d257b1b17063535f11cc729024c1b866be8055028b6451c964d501b4f300f0220369cb0d2b1bc57611b04f89ade8dffed76439113cdb68244eadeefc393f10bb5c71ae1b662456e091d842137cf303c5749bc28dd8bc4dd656b8f88b7d60ca72003781052faa98d373769cac2231b4f4969fa9fdf37595aa1d720029069c14a39b6e3b11aeddc716711637c4bd579fbc435b37c60f2b1c1c384c7aac16e1fb53b0b0d13a7f313c27c301b0e5f373692d362ea6e48e8bac95d4044b7bca22b282cea052bacc3329dc25ba56d302e095c9d63dd8841e1b29ba8d589a6209490fe98d4b4d43af806f49a10b183e9da90b90f523bead8e1a6d616d2788ffae2e559c425f75e0a8cf2a5f4047d3ff74bb7440029988cbb059e48b3ab16ac11afd231f1f357ac32e6d797e6261db0f3727f3f295ebba7f061bc9973f80cb143a355fd8f2c2873432e316410446fe03f09dbe27270c33006cc9bd9350f8868e63ab0284451868da230e99f1159b52d963fe76c381bd95db8be25d82e1ba560a6fdd7175f0290c5cca947a5d00067af054524898374bcccf72334177c5a70c8fd2a35aced9db56a1367c900930060ab4424f52daff91da4f09acf5a48e941d1c354cf02e211effcafb8c8bb39e73a600d0a7cbb70262de65987f672779f8f8a04b9e204a494bc75f2b7452c261cfea6683cea967e6be2205ceb0753ed2d8b821ea9d247c54e020c3452adc478e92b3a10ac237823c4a36a6a63f4b2ea81626133572c9346d15856cb0778cd9d4913da7eb11d0d8ccdc54c0cc4b0e072f0a48c4d1a90b3144f6f2e30db3b9dbcebccb2f903b1c5bbd99141fb258c9b8c6bec7dbab6c9e6d4728c6dead93765f811ef3531746394f13ad6c8c9fe98af561880f1a88f07e7e77e52a27092079be5ab6c1133f53f26a190de8e9a0f8bfed1042868547d993c3123d9bf8f872b60bbe63a80669e70e7dabc3c30d0d857288736a1701758b5aaf889f53f080708b4507b20d95d6225c047c36dd10a068cfe5df395d26e40996d9c11e557d13c84504710096d855df4c445714390ec0ff842d666eb4a0eb761cba4b0e01834a4480a72e67eaf4e2d3ee0f2e87d48a7730d67043ea71cde1833d8022d5b9f6eee81227e91310a93b95994c2cc14eb3ae901a7b912fda1614fe64a924d32d5d55bef13ef6fb1b272ea02c95e664c2b4607102700000000000024502cc8882958fe2edd4704265aae37c48958880e5123dc08f37396c83f791bfd601c2fe633209ba12a4cfe3eebdc07ccf603575ed5ed4069844f393adf543c3ae126328de1689ecee0ea5643af63632f87949cbc73ed58ff1f1a4d403fcdf6070632ef2f50c4fdab7e63ba5b9b63ba1e174b34a22fd37526aaffa2ad4559f84f44392f6027b7680f7f9923b4a5114ded4a996ff5ed9f00e650b5b06c061bbfc5761edb52b5cc60deb39315eb349b14cb006e5a77b8040418716c3f61a4eb6185659344ced5d03892f4201057b0552cd1567ca7d089ecf463743cd5ccde1736872139a4e131e1426364f2b319c9bc98d4e9255bf6b7abcd29e553dcbf247f255645af0280e89fb7a3221433ad763feff254c7027bd94a0fcbb0d36c15d1d51b85db37b8bcedd625c9ee05159a4c0a007f671726a9cfcbe19ffd8456200a9f0c23c801d20636f368165773e5755b9a6124a31ce37eff98cf24908461caca83ea77f497b1d830313ae3417b90fe15bcc1c4a56fac19e5f16f57dad7ba6125ed290c2bb133c8fb5311556c3be9d78ace343dd838f4860cafabfd66b2825b88b4db35ce9a09f30e7be392789222608bf000c0fc730d3861e7f6228e4b358d5e3df6dc8b955eab6acfbfe76994e147dd5abbd4b557346d25a3e46e96131b8daa9cb3fef037440cd246126c4f571d82d43a6e0f62152427728551779bf8e705f1563119d12e380832590e5040d1056057a31b137387bc1304f904627613c852e1cf832ca782586383c492b70d52234719c75da258cfbb47ed78754f2f23dc324317bc5278396c1a6ee93bb2154d6f9e89d99d3d1f51371094ac2f87eb1a3da3350dbcef48296fc81159c4edeb7075562454f74072d4c641e5054f9517f4788be8f82f65f015c11bafbdf84a3e3e5e8c1d19e59bcf529beb948884053807550f531a35d0e1370dd23f5357781d85d00356d061f78791d234754bf1ee5a2ea3b24525413e883c40c39ab2604938b98e140e1075ff60b29fb4d31ef2d4dd3427581b946a95940a8fd0236bed551f092eb3ac5f4c5b93b6673e6b5395ece94da00543eb0e6106014bf426121521bf74b4ada0e163adb05f7f74b49c8634e752cf82afe3c66ffd316a291cefa7a15d79134dc7110eeffdd054e433181759605c3a5841547f82998a9c4265ea9d655c64796f37d15c5f00399eb18daa0d61d2394e1b4d54924a459fa8bfc4cd5d41b1b9f36983d5270f1deb0f0f375ab5950848cd3a38731a0e98ac1862cec19e4d3624fd4b6e13db68207204d8267420eb883d3f6b8d9cd6345cb4c472949b7ebe1ef1a216bb6cfee3b0e7d5111749040bd0848050864b8ab9488856e5c44f2bd9516eb9ac816b598244958510e3af4b65ec887b2205c70ec4340c88a41891ccfb72cbb04af8b2581db25cc6f82bfafc27cff779c12524a9dc369f09b1c27482445cd7f71cf44aa12fea13e8baf8f52229214ccdd5e99baa19dc8d473a71b26eaa4fd344e4282eb8636e495a281aea6b2b69a2a8546bdfbd53de1a1c65851b0f84fbf54cd2afac0d8956cb5455c6603bc46e94c82a898162760384bf392d57e15b96875fb4db7d8abcd88582dc6fb8abb0c2ba1ff9faff6240893c53bea82be26bfd2ced658e97405fe86bc7dd56c653db542b49d04ebd238e039c4f6ccafc23b2b475b27fbadd0c202448fbfe75bbdecb280f52e6c183ee5dde9865a666d7487858e1abb77a82d2d05de0d52bae073373223f3398abdbd72606bc9f9f0b74bb337d4bf52ab20e50bd091f7762c1a0619ec20cc06ed9d37ca993b458a374e160d3b4b20bccd7e94aa2a7e1f0569879ec36f58e35a5315000bc20a3d261eb7fd21a71bf4adfb91ea32e5e76cdd417673719ceb03eb470cc4d3684b95a3965f635c1a7a063bd00f9c03becd961156f5671913bd17e1726e42bc1c016ab42ff834eb3a18a9a2f03efc35daf5c8911a3bccf43d21b974c7bdf9d68743db35979f78d330d67ebd45dd1b67a4a4789ed9efebb28ed813ada02247584b491c08c059a79799d5dabb94072e9341d99bd2bda12b281baa799009630eaca911b6f00ab100a2dd977b4c8e000c8ce50d1cf1b51b80c9d297de6e3030274548c0b02e9f011162c7fe38838358575877537b1b574afd6c33ba994e38d646c2fedba0803713835436244dcae0612f5dbfd37fc4b4d08163d2e9110afcf34d2983ca56afc60b0178b827e3d3f31a8ebce5afc60a19bee370979ef6abce3c20a35a43be1c4c0ff17fe2fd423af25cd6b00971ee48d3b8416d0f7c2323cc48a8b18b2069a8a3918f5aca6667b2094578a2417aa1e49a9f9ff0306fe5cb64610b036f73d54bbd3fe55cf1e1749390e293e651c73519c7e38f40590c5191350e8aad0de25d9ed25f97c027d2d75b45ed80001dbe0bf31902ed3cd4d5b5748d4a63dfad999ef615352cd57234f760654e4ed46c6a3207672afc0043f7234ea90579ac8d2210cd07fe7c2fd7f6518217b3224b25658311b706e57588acf704fdc7b65c83116c5f0bbe88377fe026814c9c8d076a09e37b9a5fba7abd208aff21380fe67ea3fbf5bafd9cb0c21ca4a42d4eb0ddc23f60c2d34fa814e000258889031791b492394906f2e03a623ea532fb10d88f94c0b155dade10b1aa1a92442ef88c3a56a0886c19a27d903e728ebbaee6d3fb30a1b86661d4591598189569b07c6eb9ef80fb2b417027c9ee332bacabb2593c21dfb3d85131cbce4ea45df40c200743be53d8b50b8597cd889e1f66629013b08a2206ff3a7032ef0fe9bf6ca5fe3443a391b796e638c2758446182372aaf19c453e386f5534c9f6cc98de5d84c570ddf013f3474bcfa5a82d88bf033c4fb4bb4ff986aeffee9b5171c5ccdf88dde3183661d767b1021296d545aa7e8161f47d17c28f15455cc3c3feb86857b4f8569fdc80b39f57248635d7b55aaf6c7d0c53a2c3a02f37a1d599f7b63f11ea0669deae51b35569367505ae6938b000a5edf6e3364035c6e9869500b8e5584fe5542e8d734f6abf128c7332dcbab4483cfc8fb4ef2981d56263d3fb8eabb7821ef9d3d4d15183a3259efcf79c42ed24bc92151602820ff8aeec33522f9108860f1c9afbf38446edeabb2e7d573446631d67ca5623b9c144595fb99d667bf18502e1c9e1b195839fcef8e8b74448df478a1151f1cd89123b8e6971c4d7d758dc7cb0b8f55136a4874ffe83fcc9cd77c243a530440652ab31442df4d3328eb2f3da92d2be927aee1fb22db4b4ace0c7434f037b5171dcb354d93584c96a2d57c934ab49fbc25e7d4915f5e9a4247f99eca37262e93aa18bb85e0de053e843cb699390d0eb515080a270c28e7f0e6dff7dff0268f8b2c8270435abc27546c4be40b2d8b1a572731a0d31c44facb693305778c18d0d59b4d0fb6bd77f1dbf2c536e1e8f33019232b2359e04a67df4bd15badf89d42dedb650b37b16bdbcd8fa0d039cd994196351378852e549bfda43ec5bd191a85f61354e8d59f4db6ff0fcb0de27cb13fb1338055a4a56c0901824bfb9282757758838058f02cbe75790989d1d5fcae85201302ece42191867b8c07c8309cadc803bed27bcbbed98dd336504f5c82d61c3033c041a39d1d06e714d6384d87953f4263a2cb184c73c316b29bddabab18f95a0e837d3278526cbd175cd95ba407ef97fd72e0c3a1184d961f29523594c4e15b3f20f6e59b7faaacd95d85d304e350c7108c55f57001fe25d4ee2c808513932e36b87abc6523f87ca03bbd06013760446bad00b204484ba5b30248c4b1a9ce911e88315a74a7b24aecc086c072eb1b5519a360137d5cd223f2e481bd1a45ad4e0e7b8a2957094d53efb6994d483487da2cb5d14365c6109f0a1c88314bdde5b5390aaa81efca09d2baf0d1fbb1712af88c1774f8a95150f5e81fbf1dea1ac1c1173276e50f2bf96ead598e082622f09e54a666105ccf6dea3dbf4dbb2af5d3c42b59fc8259ced04fe03bd7bc922bba82840ed62ea9fd8cbaf8dacae7e9c713951975b7917f32876bfab967b825e263c6855ea4949de07d7cd53be148c0671b582ae53a87f6dbd3a842fa8f78b7a5444f727450f8ed87bc02e997146079f24e2f2928e218915f068f24de3d1c4ba5be88ae32494355097e177d62c5eefb43a5d809734c59ea63d29351c75eb2953c46cf6